<?xml version="1.0" encoding="UTF-8"?>
<!--
    @(#)conformance.xml	1.1 98/12/20
    Original version copyright 1998 by Sun Microsystems, Inc.
    All Rights Reserved.
    Modifications copyright 1999 by OASIS.
    Modifications copyright 2001 by OASIS.
-->
<?xml-stylesheet href="xmlconformance.xsl" type="text/xsl"?>
<!DOCTYPE TESTSUITE SYSTEM "testcases.dtd" [

    <!-- Sun-written testcases -->
    <!ENTITY sun-valid		SYSTEM "sun/sun-valid.xml">
    <!ENTITY sun-invalid	SYSTEM "sun/sun-invalid.xml">
    <!ENTITY sun-not-wf		SYSTEM "sun/sun-not-wf.xml">
    <!ENTITY sun-error		SYSTEM "sun/sun-error.xml">

    <!-- James Clark "XMLTEST" -->
    <!ENTITY jclark-xmltest	SYSTEM "xmltest/xmltest.xml">

    <!-- Fuji Xerox "Japanese Documents" -->
    <!ENTITY xerox-japanese	SYSTEM "japanese/japanese.xml">

    <!-- NIST/OASIS test suite -->
    <!ENTITY nist-oasis		SYSTEM "oasis/oasis.xml">
	
    <!-- IBM tests -->
    <!ENTITY ibm-invalid	SYSTEM "ibm/ibm_oasis_invalid.xml">
    <!ENTITY ibm-not-wf		SYSTEM "ibm/ibm_oasis_not-wf.xml">
    <!ENTITY ibm-valid		SYSTEM "ibm/ibm_oasis_valid.xml">
    <!ENTITY ibm-xml1.1-invalid SYSTEM "ibm/xml-1.1/ibm_invalid.xml">
    <!ENTITY ibm-xml1.1-not-wf  SYSTEM "ibm/xml-1.1/ibm_not-wf.xml">
    <!ENTITY ibm-xml1.1-valid   SYSTEM "ibm/xml-1.1/ibm_valid.xml">

    <!-- Edinburgh University tests -->
    <!ENTITY eduni-errata2e	SYSTEM "eduni/errata-2e/errata2e.xml">
    <!ENTITY eduni-xml11	SYSTEM "eduni/xml-1.1/xml11.xml">
    <!ENTITY eduni-ns10		SYSTEM "eduni/namespaces/1.0/rmt-ns10.xml">
    <!ENTITY eduni-ns11		SYSTEM "eduni/namespaces/1.1/rmt-ns11.xml">
    <!ENTITY eduni-errata3e	SYSTEM "eduni/errata-3e/errata3e.xml">
    <!ENTITY eduni-nse		SYSTEM "eduni/namespaces/errata-1e/errata1e.xml">
] >
<TESTSUITE PROFILE="XML 1.0 (2nd edition) W3C Conformance Test Suite, 6 October 2000">
<TESTCASES PROFILE="James Clark  XML 1.0 Tests" xml:base="xmltest/">
    &jclark-xmltest;
</TESTCASES>

<TESTCASES PROFILE="Fuji Xerox Japanese Text Tests XML 1.0 Tests" xml:base="japanese/">    
    &xerox-japanese;
</TESTCASES>

<TESTCASES PROFILE="Sun Microsystems XML Tests" xml:base="sun/">
    &sun-valid;
    &sun-invalid;
    &sun-not-wf;
    &sun-error;
</TESTCASES>

<TESTCASES PROFILE="OASIS/NIST XML 1.0 Tests" xml:base="oasis/">
    &nist-oasis;
</TESTCASES>
    
<TESTCASES PROFILE="IBM XML 1.0 Tests" xml:base="ibm/">
    &ibm-invalid;
    &ibm-not-wf;
    &ibm-valid;
</TESTCASES>
<!-- Wrapping TESTCASES elements below added by Dieter KÃ¶hler -->
<TESTCASES PROFILE="IBM XML 1.1 Tests" xml:base="ibm/xml-1.1/">
    &ibm-xml1.1-invalid;
    &ibm-xml1.1-not-wf;
    &ibm-xml1.1-valid;
</TESTCASES>

<TESTCASES xml:base="eduni/errata-2e/">
    &eduni-errata2e;
</TESTCASES>
<TESTCASES xml:base="eduni/xml-1.1/">
    &eduni-xml11;
</TESTCASES>
<TESTCASES xml:base="eduni/namespaces/1.0/">
    &eduni-ns10;
</TESTCASES>
<TESTCASES xml:base="eduni/namespaces/1.1/">
    &eduni-ns11;
</TESTCASES>
<TESTCASES xml:base="eduni/errata-3e/">
    &eduni-errata3e;
</TESTCASES>
<TESTCASES xml:base="eduni/namespaces/errata-1e/">
    &eduni-nse;
</TESTCASES>

</TESTSUITE>
